<?xml version="1.0" encoding="UTF-8"?>
<manifest identifier="njr01-u02-digital-mindset"
          version="1.0"
          xmlns="http://www.imsproject.org/xsd/imscp_rootv1p1p2"
          xmlns:adlcp="http://www.adlnet.org/xsd/adlcp_rootv1p2"
          xmlns:xsi="http://www.w3.org/2001/XMLSchema-instance"
          xsi:schemaLocation="http://www.imsproject.org/xsd/imscp_rootv1p1p2 imscp_rootv1p1p2.xsd
                              http://www.adlnet.org/xsd/adlcp_rootv1p2 adlcp_rootv1p2.xsd">

  <metadata>
    <schema>ADL SCORM</schema>
    <schemaversion>1.2</schemaversion>
  </metadata>

  <organizations default="org_njr01_u02">
    <organization identifier="org_njr01_u02">
      <title>الذهنية الرقمية وممارسات الابتكار التقني</title>

      <item identifier="item_sco_01" identifierref="sco_01" isvisible="true">
        <title>مقدمة الوحدة</title>
      </item>

      <item identifier="item_sco_02" identifierref="sco_02" isvisible="true">
        <title>الاختبار القبلي</title>
      </item>

      <item identifier="item_sco_03" identifierref="sco_03" isvisible="true">
        <title>أساسيات الابتكار</title>
      </item>

      <item identifier="item_sco_04" identifierref="sco_04" isvisible="true">
        <title>عقلية الابتكار التقني والتفكير التصميمي</title>
      </item>

      <item identifier="item_sco_05" identifierref="sco_05" isvisible="true">
        <title>من الفكرة إلى السوق</title>
      </item>

      <item identifier="item_sco_06" identifierref="sco_06" isvisible="true">
        <title>الأنشطة التفاعلية</title>
      </item>

      <item identifier="item_sco_07" identifierref="sco_07" isvisible="true">
        <title>الاختبار البعدي</title>
      </item>

    </organization>
  </organizations>

  <resources>

    <resource identifier="sco_01" type="webcontent" adlcp:scormtype="sco" href="sco_01_introduction/index.html">
      <file href="sco_01_introduction/index.html"/>
      <dependency identifierref="shared_resources"/>
    </resource>

    <resource identifier="sco_02" type="webcontent" adlcp:scormtype="sco" href="sco_02_pretest/index.html">
      <file href="sco_02_pretest/index.html"/>
      <dependency identifierref="shared_resources"/>
    </resource>

    <resource identifier="sco_03" type="webcontent" adlcp:scormtype="sco" href="sco_03_foundations/index.html">
      <file href="sco_03_foundations/index.html"/>
      <dependency identifierref="shared_resources"/>
    </resource>

    <resource identifier="sco_04" type="webcontent" adlcp:scormtype="sco" href="sco_04_innovation_mindset/index.html">
      <file href="sco_04_innovation_mindset/index.html"/>
      <dependency identifierref="shared_resources"/>
    </resource>

    <resource identifier="sco_05" type="webcontent" adlcp:scormtype="sco" href="sco_05_idea_to_market/index.html">
      <file href="sco_05_idea_to_market/index.html"/>
      <dependency identifierref="shared_resources"/>
    </resource>

    <resource identifier="sco_06" type="webcontent" adlcp:scormtype="sco" href="sco_06_activities/index.html">
      <file href="sco_06_activities/index.html"/>
      <dependency identifierref="shared_resources"/>
    </resource>

    <resource identifier="sco_07" type="webcontent" adlcp:scormtype="sco" href="sco_07_posttest/index.html">
      <file href="sco_07_posttest/index.html"/>
      <dependency identifierref="shared_resources"/>
    </resource>

    <resource identifier="shared_resources" type="webcontent" adlcp:scormtype="asset">
      <file href="shared/scorm-api.js"/>
      <file href="shared/behavior-tracker.js"/>
      <file href="shared/gamification.js"/>
      <file href="shared/base.css"/>
      <file href="shared/player-shell.css"/>
      <file href="shared/theme.css"/>
      <file href="shared/course-custom.css"/>
      <file href="shared/engine/slide-controller.js"/>
      <file href="shared/engine/quiz-engine.js"/>
      <file href="shared/engine/player-shell.js"/>
      <file href="shared/engine/state-engine.js"/>
      <file href="shared/engine/trigger-engine.js"/>
      <file href="shared/engine/variable-store.js"/>
      <file href="shared/engine/sound-effects.js"/>
      <file href="shared/engine/confetti.js"/>
      <file href="shared/engine/achievement-system.js"/>
      <file href="shared/assets/icons/arrow-next.svg"/>
      <file href="shared/assets/icons/arrow-prev.svg"/>
      <file href="shared/assets/icons/check-circle.svg"/>
      <file href="shared/assets/icons/info.svg"/>
      <file href="shared/assets/icons/star.svg"/>
      <file href="shared/assets/icons/trophy.svg"/>
      <file href="shared/assets/icons/warning.svg"/>
      <file href="shared/assets/icons/x-circle.svg"/>
    </resource>

  </resources>

</manifest>
